{
  "$schema": "https://json-schema.org/draft/2020-12/schema",
  "$id": "https://sklarzcreative.com/schemas/case-study.schema.json",
  "title": "Case study",
  "description": "The canonical twelve-section case-study structure, with MISSING EVIDENCE as a first-class value. An unevidenced section is the string 'MISSING EVIDENCE' — never plausible prose, never a hedge. 'Early results were encouraging' is a fabrication wearing a hedge, and it is worse than the gap because a reader cannot spot it.",
  "type": "object",
  "required": ["schema_version", "case_id", "status", "publishable", "client", "permission", "sections", "evidence_gaps"],
  "additionalProperties": false,
  "properties": {
    "schema_version": { "const": "1.0" },
    "case_id": { "type": "string", "minLength": 1 },
    "created_at": { "type": ["string", "null"], "format": "date-time" },
    "updated_at": { "type": ["string", "null"], "format": "date-time" },

    "status": {
      "type": "string",
      "enum": ["draft", "missing_evidence", "awaiting_permission", "evidence_complete", "ready_for_review", "published"],
      "description": "'published' is set by a human publishing it, never by the agent."
    },
    "publishable": {
      "const": false,
      "description": "The agent may only ever write false. There is no automated path from 'the fields are filled in' to 'this is on the website making claims about a real client'. A human publishing it is what changes this, by hand, outside the agent."
    },

    "client": {
      "type": "object",
      "required": ["named", "descriptor"],
      "additionalProperties": false,
      "properties": {
        "named": { "type": "boolean", "description": "true requires permission.client_named === true." },
        "name": { "type": ["string", "null"], "description": "Present only with recorded permission." },
        "descriptor": { "type": "string", "minLength": 5, "description": "The anonymous form, e.g. 'a Series A medical-device company'. Always present, because anonymised-but-true beats named-but-embellished and is available without waiting for a permission conversation." },
        "sector": { "type": ["string", "null"] }
      },
      "dependentRequired": { "name": ["named"] }
    },

    "permission": {
      "type": "object",
      "required": ["client_named", "quotes_permitted", "metrics_permitted"],
      "additionalProperties": false,
      "properties": {
        "client_named": { "type": "boolean" },
        "quotes_permitted": { "type": "boolean" },
        "metrics_permitted": { "type": "boolean" },
        "granted_by": { "type": ["string", "null"], "description": "Who granted it. Silence, an old email, and 'they would probably be fine with it' are not permission." },
        "granted_at": { "type": ["string", "null"], "format": "date-time" },
        "record": { "type": ["string", "null"], "description": "Where the permission is recorded, so it can be produced if questioned." }
      }
    },

    "sections": {
      "type": "object",
      "required": ["context", "problem", "constraints", "role", "research", "strategic_decision", "work_created", "why_those_decisions", "observable_outcome", "what_was_learned", "related_capabilities", "cta"],
      "additionalProperties": false,
      "properties": {
        "context": { "$ref": "#/$defs/prose" },
        "problem": { "$ref": "#/$defs/prose" },
        "constraints": { "$ref": "#/$defs/list", "description": "May legitimately be empty — sometimes there were none worth naming." },
        "role": { "$ref": "#/$defs/role" },
        "research": { "$ref": "#/$defs/list" },
        "strategic_decision": { "$ref": "#/$defs/decision" },
        "work_created": { "$ref": "#/$defs/list" },
        "why_those_decisions": { "$ref": "#/$defs/prose" },
        "observable_outcome": { "$ref": "#/$defs/outcome" },
        "what_was_learned": { "$ref": "#/$defs/list" },
        "related_capabilities": { "$ref": "#/$defs/list", "description": "Drawn from the site's own capability list. Not invented." },
        "cta": { "$ref": "#/$defs/prose" }
      }
    },

    "evidence_gaps": {
      "type": "array",
      "description": "The deliverable when evidence is short: a precise list of what to ask for and who can supply it. 'We are missing the outcome' is not actionable; 'ask whether the launch metric can be quoted' is.",
      "items": {
        "type": "object",
        "required": ["section", "what_is_needed", "who_can_supply"],
        "additionalProperties": false,
        "properties": {
          "section": { "type": "string" },
          "what_is_needed": { "type": "string", "minLength": 5 },
          "who_can_supply": { "type": "string", "minLength": 2 },
          "blocks_publication": { "type": "boolean", "default": true }
        }
      }
    },

    "nothing_inferred": {
      "const": true,
      "description": "An explicit assertion that every value came from a named input. A run that cannot make this statement has failed."
    }
  },

  "$defs": {
    "MISSING": { "const": "MISSING EVIDENCE" },
    "prose": {
      "oneOf": [
        { "type": "string", "minLength": 20 },
        { "$ref": "#/$defs/MISSING" }
      ]
    },
    "list": {
      "oneOf": [
        { "type": "array", "items": { "type": "string", "minLength": 3 } },
        { "$ref": "#/$defs/MISSING" }
      ]
    },
    "role": {
      "oneOf": [
        {
          "type": "object",
          "required": ["responsible_for", "not_responsible_for"],
          "additionalProperties": false,
          "properties": {
            "responsible_for": { "type": "array", "minItems": 1, "items": { "type": "string" } },
            "not_responsible_for": { "type": "array", "items": { "type": "string" }, "description": "Stated explicitly. An unbounded role reads as an inflated one." }
          }
        },
        { "$ref": "#/$defs/MISSING" }
      ]
    },
    "decision": {
      "oneOf": [
        {
          "type": "object",
          "required": ["decision", "alternative_rejected"],
          "additionalProperties": false,
          "properties": {
            "decision": { "type": "string", "minLength": 20 },
            "alternative_rejected": { "type": "string", "minLength": 10, "description": "THE REJECTED OPTION IS THE CREDIBILITY. A case study with no discarded alternative reads as a description of the only thing anyone could have done." },
            "why_rejected": { "type": ["string", "null"] }
          }
        },
        { "$ref": "#/$defs/MISSING" }
      ]
    },
    "outcome": {
      "description": "Something a third party could verify. Never inferred, never estimated, never softened into an adjective.",
      "oneOf": [
        {
          "type": "object",
          "required": ["observable", "verifiable_by", "measured"],
          "additionalProperties": false,
          "properties": {
            "observable": { "type": "string", "minLength": 10, "description": "'The site launched on 3 March' is an outcome. 'Engagement improved' without a measurement is not." },
            "verifiable_by": { "type": "string", "minLength": 3, "description": "How a sceptic could check it." },
            "measured": { "type": "boolean" },
            "metrics": {
              "type": "array",
              "items": {
                "type": "object",
                "required": ["label", "value", "source", "permitted"],
                "additionalProperties": false,
                "properties": {
                  "label": { "type": "string" },
                  "value": { "type": "string", "description": "Verbatim as supplied. Never rounded up, never reframed as a multiple." },
                  "source": { "type": "string", "minLength": 3 },
                  "permitted": { "const": true, "description": "A metric may only appear if permission.metrics_permitted is true." }
                }
              }
            }
          }
        },
        { "$ref": "#/$defs/MISSING" }
      ]
    }
  }
}
